{
  "registry_id": "01JABCDE7Y6G4KQ8QNF2S8T9A3",
  "version": "1.0.0",
  "artifact": {
    "type": "document",
    "name": "technical-spec",
    "description": "Initial registry entry for a technical specification"
  },
  "proof": {
    "hash": "3f785c10b7d28d6dbbb4683cf6e2f835c26d5f8a2ab1764a7a55e0bcaf8c2e0d",
    "algorithm": "SHA-256",
    "timestamp": "2025-12-09T12:00:00Z",
    "content_type": "text",
    "canonicalization": "CNAUS-1.0",
    "source": "root-authority"
  },
  "license": {
    "license_id": "LIC-0001",
    "valid_from": "2025-12-09T12:00:00Z",
    "valid_to": null,
    "status": "active"
  },
  "metadata": {
    "created_at": "2025-12-09T12:00:00Z",
    "updated_at": "2025-12-09T12:00:00Z",
    "created_by": "root-authority",
    "notes": null
  }
}
